question,answer,timestamp,source
who is maharana pratap,"Pratap Singh I (18 May 1540 – 19 January 1597), popularly known as Maharana Pratap (IPA: [məɦaːˈɾaːɳaː pɾəˈtaːp] ), was king of the Kingdom of Mewar, in north-western India in the present-day state of Rajasthan, from 1572 until his death in 1597. He is notable for leading the Rajput resistance against the expansionist policy of the Mughal Emperor Akbar including the battle of Haldighati.


== Early life and accession ==
Maharana Pratap was born to Udai Singh II of Mewar and Jaiwanta Bai in 1540, the year in which Udai Singh ascended to the throne after defeating Vanvir Singh.",2026-03-15 07:11:00,wikipedia
who is meant by artificial intelligence,"Generative artificial intelligence, also known as generative AI or GenAI, is a subfield of artificial intelligence that uses generative models to generate text, images, videos, audio, software code or other forms of data. These models learn the underlying patterns and structures of their training data, and use them to generate new data in response to input, which often takes the form of natural language prompts.
The prevalence of generative AI tools has increased significantly since the AI boom in the 2020s.",2026-03-15 07:12:38,wikipedia
